{
  "title": "Synthetic complete report",
  "source": {
    "durationSeconds": 10.0,
    "fps": 30.0
  },
  "evidenceLabels": [
    "Verified",
    "Observed",
    "Estimated",
    "Inferred"
  ],
  "modules": [
    {"id": 1, "title": "Module 1", "status": "complete"},
    {"id": 2, "title": "Module 2", "status": "complete"},
    {"id": 3, "title": "Module 3", "status": "complete"},
    {"id": 4, "title": "Module 4", "status": "complete"},
    {"id": 5, "title": "Module 5", "status": "complete"},
    {"id": 6, "title": "Module 6", "status": "complete"},
    {"id": 7, "title": "Module 7", "status": "complete"},
    {"id": 8, "title": "Module 8", "status": "complete"},
    {"id": 9, "title": "Module 9", "status": "complete"},
    {"id": 10, "title": "Module 10", "status": "complete"},
    {"id": 11, "title": "Module 11", "status": "complete"},
    {"id": 12, "title": "Module 12", "status": "complete"},
    {"id": 13, "title": "Module 13", "status": "complete"},
    {"id": 14, "title": "Module 14", "status": "complete"},
    {"id": 15, "title": "Module 15", "status": "complete"},
    {"id": 16, "title": "Module 16", "status": "complete"},
    {"id": 17, "title": "Module 17", "status": "complete"},
    {"id": 18, "title": "Module 18", "status": "complete"},
    {"id": 19, "title": "Module 19", "status": "complete"},
    {"id": 20, "title": "Module 20", "status": "complete"},
    {"id": 21, "title": "Module 21", "status": "complete"},
    {"id": 22, "title": "Module 22", "status": "complete"},
    {"id": 23, "title": "Module 23", "status": "complete"},
    {"id": 24, "title": "Module 24", "status": "complete"},
    {"id": 25, "title": "Module 25", "status": "complete"}
  ],
  "shots": [
    {
      "id": "S01",
      "start": 0.0,
      "end": 1.0,
      "screenshots": ["before.jpg", "middle.jpg", "after.jpg"],
      "animations": [
        {
          "name": "Scale pop",
          "evidence": "Estimated",
          "properties": ["scale", "opacity"],
          "durationSeconds": 0.3,
          "durationFrames": 9,
          "timingFamily": "back-out",
          "soundCue": "soft click",
          "productMeaning": "responsive confirmation"
        }
      ],
      "productMapping": "The restrained overshoot communicates responsiveness without toy-like playfulness."
    }
  ],
  "pdfQa": {
    "renderedAllPages": true,
    "noOverflow": true,
    "screenshotsLegible": true
  }
}